{
  "schemaVersion": 1,
  "manifestKind": "routes",
  "predecessorCommit": "23d617bf19e1eab98070c3477fd787a69bb157ae",
  "sourceAuthority": "tests/visual/monochrome/route-manifest.ts",
  "sourceCommit": "7eb708e184ee4f054a49d3e70d73e80fd4eb97ae",
  "finalRouteIds": [
    "chat",
    "canvas",
    "workbench",
    "preview",
    "browser",
    "terminal",
    "kanban",
    "schedule",
    "agents",
    "agent-detail",
    "project-detail",
    "context",
    "skills",
    "benchmarks",
    "history",
    "tools",
    "files",
    "account"
  ],
  "settingsTabIds": [
    "account",
    "plans",
    "providers",
    "connections",
    "hive",
    "allaboutme",
    "plugins",
    "localmodels",
    "appearance",
    "voice",
    "composerstt",
    "phone",
    "ambient",
    "notifications",
    "accessibility",
    "hotkeys",
    "jarvisactions",
    "admin",
    "about"
  ],
  "entries": [
    {
      "id": "access:app-host",
      "kind": "access",
      "routeId": null,
      "auditStatus": "covered",
      "availability": "feature-flagged",
      "owner": "SK7F",
      "requirements": ["SAK-010", "SAK-030", "SAK-033", "SAK-040", "SAK-048", "SAK-038"],
      "sourcePaths": ["app/src/features/access/AccessAppHost.tsx"],
      "writerPaths": ["app/src/features/access/AccessAppHost.tsx"],
      "testPaths": ["app/src/features/access/AccessAppHost.test.tsx"],
      "behaviorCommands": [
        "npm --prefix app test -- src/features/access/AccessAppHost.test.tsx --maxWorkers=1 --minWorkers=1"
      ],
      "viewports": ["1672x941", "1024x768", "narrow-desktop"],
      "zoom": ["50%", "80%", "100%", "125%", "200%"],
      "motion": ["no-preference", "reduce"],
      "baselineCaptureIds": ["default-settings", "jarvis-settings", "vibespace-settings"],
      "logicalLock": "sakura:access:app-host",
      "fileLockPaths": ["app/src/features/access/AccessAppHost.tsx"],
      "sharedReadOnlyPaths": [],
      "exclusions": [
        "business behavior",
        "user or remote content",
        "non-Sakura themes",
        "backend, schema, auth, and billing changes"
      ],
      "unavailableReason": null
    },
    {
      "id": "access:banner",
      "kind": "access",
      "routeId": null,
      "auditStatus": "covered",
      "availability": "feature-flagged",
      "owner": "SK7F",
      "requirements": ["SAK-010", "SAK-030", "SAK-033", "SAK-040", "SAK-048", "SAK-038"],
      "sourcePaths": ["app/src/features/access/AccessBanner.tsx"],
      "writerPaths": ["app/src/features/access/AccessBanner.tsx"],
      "testPaths": ["app/src/features/access/AccessBanner.test.tsx"],
      "behaviorCommands": [
        "npm --prefix app test -- src/features/access/AccessBanner.test.tsx --maxWorkers=1 --minWorkers=1"
      ],
      "viewports": ["1672x941", "1024x768", "narrow-desktop"],
      "zoom": ["50%", "80%", "100%", "125%", "200%"],
      "motion": ["no-preference", "reduce"],
      "baselineCaptureIds": ["default-settings", "jarvis-settings", "vibespace-settings"],
      "logicalLock": "sakura:access:banner",
      "fileLockPaths": ["app/src/features/access/AccessBanner.tsx"],
      "sharedReadOnlyPaths": [],
      "exclusions": [
        "business behavior",
        "user or remote content",
        "non-Sakura themes",
        "backend, schema, auth, and billing changes"
      ],
      "unavailableReason": null
    },
    {
      "id": "access:locked",
      "kind": "access",
      "routeId": null,
      "auditStatus": "covered",
      "availability": "feature-flagged",
      "owner": "SK7F",
      "requirements": ["SAK-010", "SAK-030", "SAK-033", "SAK-040", "SAK-048", "SAK-038"],
      "sourcePaths": ["app/src/features/access/AccessPaywall.tsx"],
      "writerPaths": ["app/src/features/access/AccessPaywall.tsx"],
      "testPaths": ["app/src/features/access/AccessPaywall.test.tsx"],
      "behaviorCommands": [
        "npm --prefix app test -- src/features/access/AccessPaywall.test.tsx --maxWorkers=1 --minWorkers=1"
      ],
      "viewports": ["1672x941", "1024x768", "narrow-desktop"],
      "zoom": ["50%", "80%", "100%", "125%", "200%"],
      "motion": ["no-preference", "reduce"],
      "baselineCaptureIds": ["default-settings", "jarvis-settings", "vibespace-settings"],
      "logicalLock": "sakura:access:locked",
      "fileLockPaths": ["app/src/features/access/AccessPaywall.tsx"],
      "sharedReadOnlyPaths": [],
      "exclusions": [
        "business behavior",
        "user or remote content",
        "non-Sakura themes",
        "backend, schema, auth, and billing changes"
      ],
      "unavailableReason": null
    },
    {
      "id": "development:monochrome-workbench",
      "kind": "development",
      "routeId": null,
      "auditStatus": "development-only",
      "availability": "development-only",
      "owner": "SK4",
      "requirements": ["SAK-010", "SAK-030", "SAK-033", "SAK-040", "SAK-048", "SAK-027", "SAK-031"],
      "sourcePaths": ["app/src/features/appearance/MonochromeWorkbench.tsx"],
      "writerPaths": [],
      "testPaths": ["app/src/features/appearance/MonochromeWorkbench.test.tsx"],
      "behaviorCommands": [
        "npm --prefix app test -- src/features/appearance/MonochromeWorkbench.test.tsx --maxWorkers=1 --minWorkers=1"
      ],
      "viewports": ["1672x941", "1024x768", "narrow-desktop"],
      "zoom": ["50%", "80%", "100%", "125%", "200%"],
      "motion": ["no-preference", "reduce"],
      "baselineCaptureIds": ["default-terminal", "jarvis-terminal", "vibespace-terminal"],
      "logicalLock": "sakura:development:monochrome-workbench",
      "fileLockPaths": [],
      "sharedReadOnlyPaths": [
        "app/src/features/appearance/MonochromeWorkbench.tsx",
        "app/src/features/appearance/MonochromeWorkbench.test.tsx"
      ],
      "exclusions": [
        "business behavior",
        "user or remote content",
        "non-Sakura themes",
        "backend, schema, auth, and billing changes"
      ],
      "unavailableReason": null
    },
    {
      "id": "embedded:browser-operator",
      "kind": "embedded",
      "routeId": null,
      "auditStatus": "covered",
      "availability": "production",
      "owner": "SK7E",
      "requirements": ["SAK-010", "SAK-030", "SAK-033", "SAK-040", "SAK-048", "SAK-019", "SAK-049"],
      "sourcePaths": ["app/src/features/browser/browserActions.ts"],
      "writerPaths": [],
      "testPaths": ["app/src/features/browser/browserActions.test.ts"],
      "behaviorCommands": [
        "npm --prefix app test -- src/features/browser/browserActions.test.ts --maxWorkers=1 --minWorkers=1"
      ],
      "viewports": ["1672x941", "1024x768", "narrow-desktop"],
      "zoom": ["50%", "80%", "100%", "125%", "200%"],
      "motion": ["no-preference", "reduce"],
      "baselineCaptureIds": ["default-chat", "jarvis-chat", "vibespace-chat", "origami-chat"],
      "logicalLock": "sakura:embedded:browser-operator",
      "fileLockPaths": [],
      "sharedReadOnlyPaths": [
        "app/src/features/browser/BrowserPage.tsx",
        "app/src/features/browser/browserActions.ts"
      ],
      "exclusions": [
        "business behavior",
        "user or remote content",
        "non-Sakura themes",
        "backend, schema, auth, and billing changes"
      ],
      "unavailableReason": null
    },
    {
      "id": "embedded:command-center",
      "kind": "embedded",
      "routeId": null,
      "auditStatus": "covered",
      "availability": "production",
      "owner": "SK7A",
      "requirements": ["SAK-010", "SAK-030", "SAK-033", "SAK-040", "SAK-048", "SAK-028", "SAK-029"],
      "sourcePaths": ["app/src/features/jarvis-command-center/JarvisCommandCenter.tsx"],
      "writerPaths": ["app/src/features/jarvis-command-center/JarvisCommandCenter.tsx"],
      "testPaths": ["app/src/features/jarvis-command-center/JarvisCommandCenter.test.tsx"],
      "behaviorCommands": [
        "npm --prefix app test -- src/features/jarvis-command-center/JarvisCommandCenter.test.tsx --maxWorkers=1 --minWorkers=1"
      ],
      "viewports": ["1672x941", "1024x768", "narrow-desktop"],
      "zoom": ["50%", "80%", "100%", "125%", "200%"],
      "motion": ["no-preference", "reduce"],
      "baselineCaptureIds": ["default-chat", "jarvis-chat", "vibespace-chat", "origami-chat"],
      "logicalLock": "sakura:embedded:command-center",
      "fileLockPaths": ["app/src/features/jarvis-command-center/JarvisCommandCenter.tsx"],
      "sharedReadOnlyPaths": [],
      "exclusions": [
        "business behavior",
        "user or remote content",
        "non-Sakura themes",
        "backend, schema, auth, and billing changes"
      ],
      "unavailableReason": null
    },
    {
      "id": "embedded:prompt-forge",
      "kind": "embedded",
      "routeId": null,
      "auditStatus": "covered",
      "availability": "production",
      "owner": "SK7D",
      "requirements": ["SAK-010", "SAK-030", "SAK-033", "SAK-040", "SAK-048", "SAK-019"],
      "sourcePaths": ["app/src/features/prompt-forge/PromptForgeControl.tsx"],
      "writerPaths": ["app/src/features/prompt-forge/PromptForgeControl.tsx"],
      "testPaths": ["app/src/features/prompt-forge/PromptForgeControl.test.tsx"],
      "behaviorCommands": [
        "npm --prefix app test -- src/features/prompt-forge/PromptForgeControl.test.tsx --maxWorkers=1 --minWorkers=1"
      ],
      "viewports": ["1672x941", "1024x768", "narrow-desktop"],
      "zoom": ["50%", "80%", "100%", "125%", "200%"],
      "motion": ["no-preference", "reduce"],
      "baselineCaptureIds": ["default-chat", "jarvis-chat", "vibespace-chat", "origami-chat"],
      "logicalLock": "sakura:embedded:prompt-forge",
      "fileLockPaths": ["app/src/features/prompt-forge/PromptForgeControl.tsx"],
      "sharedReadOnlyPaths": [],
      "exclusions": [
        "business behavior",
        "user or remote content",
        "non-Sakura themes",
        "backend, schema, auth, and billing changes"
      ],
      "unavailableReason": null
    },
    {